screen_name,created_at,location,source,hashtags,text
swift_chris,2020-04-21 16:28:12,"Chicago, IL",Twitter for iPhone,,So. The first governor to start re-opening his state is the one who said last month that he didn't know COVID could be passed by asymptomatic persons? Do I have that right?
JeydithMd,2020-04-21 16:28:12,"Iowa City, IA",Twitter for iPhone,,"@DBelardoMD I have otter box, keep it in my pocket underneeth ppe while on a covid patient room, when outside the room always sanitize hands before/after using, only speaker/bluetooth, wipe with face shield wipes often. @ home wipe down with disinfecting wipes again before entering. StaySafe"
histsolu,2020-04-21 16:28:11,"Fishers, IN",Twitter Web Client,"COVIDー19, leadership","Covid-19 and your leadership--one of your greatest and most difficult challenges is true and truth--so many things clawing at them, pulling them apart, undercutting--this is a true and factual story for you to consider as a leader. https://t.co/NDQR4UlQyk #COVIDー19 #leadership"
amiinnaa__,2020-04-21 16:28:11,"Atlanta, GA",Twitter for iPhone,,Skylar Herbert has become the youngest victim in the state of Michigan to pass away from COVID-19 at 5 years old. Our prayers go out to her family at this time. 🕊 https://t.co/155FmdR9Z1
ForeignPressCtr,2020-04-21 16:28:11,"Washington, DC & New York, NY",TweetDeck,"ICYMI, COVID19, pandemics, FPCinAction","#ICYMI last week Dr. Jon Andrus briefed FPC credentialed journalists on how #COVID19 historically compares to other #pandemics. You can find video and transcripts on our website.

 https://t.co/kZfOwJFjVF

#FPCinAction"
WayneJRivera2,2020-04-21 16:28:11,"Littleton, CO",Twitter for Android,,"😳FINES &amp; JAIL TIME if you don’t stay IN YOUR HOUSE...

....unless you’re part of the deep state high society club that is. 💁‍♀️

👉🏻George Stephanopoulos Walking in the Hamptons After COVID-19 Diagnosis👈🏻
https://t.co/7MzkjZ8Fhf"
Marco73838565,2020-04-21 16:28:11,"Parkland, FL",Twitter for iPhone,,Everyone seeking to understand the extent of Trump’s botched response to COVID-19 must recognize that Trump wasted one of the country’s best weapons to fight a pandemic: The Strategic National Stockpile of protective equipment. https://t.co/5ABsuqCZnr
KyReeDFincher,2020-04-21 16:28:10,"Dallas, TX",Twitter for iPhone,,COVID-19 hearing some States are opening public businesses as early as Friday. https://t.co/UQZl2wdRh4
cappucinopapi,2020-04-21 16:28:10,"Atlanta, GA",Twitter for iPhone,,"If you could end Covid-19 by sacrificing one NHL team, which team would you choose and why Pittsburgh?"
KaraNextWeek,2020-04-21 16:28:10,"Philadelphia, PA",Twitter for iPhone,,"Do you have unused personal protective equipment that you’d like to donate? We’re experiencing serious shortages on items such as eye protection, face masks, and more. Learn how to donate ⬇️ https://t.co/OHSzDgwv2O"
4CDLive,2020-04-21 16:28:10,"East Bay Area, California",Hootsuite Inc.,"CCMonth, HealthcareHeroes",Community college nursing students and faculty are devoting themselves to the battle against COVID-19 by volunteering at hospitals and mapping out emergency room management plans https://t.co/RH0Vyl5B0j #CCMonth #HealthcareHeroes
cinbee,2020-04-21 16:28:10,"San Francisco Bay Area, CA",Twitter Web App,,"“We haven’t known the true extent of Covid-19 infections in our community because we have only tested people with symptoms, and the availability of tests has been limited."" Said Neeraj Sood, a professor of public policy. https://t.co/HLwAul4qaS"
MandelSchool,2020-04-21 16:28:09,"Cleveland, Ohio",Twitter Web App,COVID19,This map—designed by a team of @CaseEngineer data scientists and researchers—identifies the relative risk of #COVID19 exposure in any location within the United States. https://t.co/JQDD22lkQY #CWRU
dclieb,2020-04-21 16:28:09,"Norfolk, VA",Twitter for Android,diabetes,"Why is #diabetes a risk factor for poorer outcomes in COVID-19?
How can we improve glycemic control to improve outcomes?

This article discusses the potential role of DPP-IV &amp; GLP1agonists.

We’ll discuss this &amp; more at #EndoJC 4/23 at 9p ET.

#EndoTwitter
https://t.co/HM5AFOtgV2 https://t.co/3eEljnDnTs"
AugsburgU,2020-04-21 16:28:09,"Minneapolis, Minnesota, U.S.A.",Twitter for iPhone,,Join us tonight for a conversation with Dr. Mueller '84 on how the @MayoClinic Health System has been responding to COVID-19 and the research being done in that area. https://t.co/Iu8Xh4LfiZ
GeoffreyOgden,2020-04-21 16:28:08,"Gresham, OR",Twitter Web App,,"There were 675,000 estimated ''1918 Spanish influenza"" deaths in total. But the deaths caused by bacterial infections may have been about 350,000 of them. There were other secondary illnesses too (just as there are with covid-19)."
dazyjane410,2020-04-21 16:28:08,"Sunset, FL",Twitter for iPhone,,Everyone seeking to understand the extent of Trump’s botched response to COVID-19 must recognize that Trump wasted one of the country’s best weapons to fight a pandemic: The Strategic National Stockpile of protective equipment. https://t.co/5ABsuqCZnr
urbnfarmer,2020-04-21 16:28:07,"Montague, MI",Twitter Web App,,"Even after death, COVID-19 could be contagious, a new report finds. 
https://t.co/Y2yhoLSsb3"
AdvHntr,2020-04-21 16:28:07,"Waco, Republic of Texas",Twitter for iPhone,,"Before CCP was killing people with Covid-19, they were killing people with fentanyl"
McneJames,2020-04-21 16:28:07,"Detroit, MI",Twitter Web App,,"Celebrated Austin artist Christopher Cross temporarily paralyzed due to COVID-19 complications
https://t.co/5D1jsfuJZL"
DebLRobison,2020-04-21 16:28:06,"Boston, MA",Twitter Web App,,"NEWS: Adults now able to get free meals at sites in East Boston, Mattapan, Dorchester, Roxbury, East Boston and Brighton &gt;&gt; https://t.co/ZMiDHbJu5o
#COVID19 #coronavirus"
TerranEmpire,2020-04-21 16:28:06,"Saint Augustine, FL",Twitter Web Client,,‘You need to STOP’: Doctor BUSTS Sen. Tammy Duckworth for pushing lies about Governors going without COVID supplies https://t.co/N90GgHVu7R via @twitchyteam
thefdagroup,2020-04-21 16:28:06,"Westborough, MA",TweetDeck,Regulatory,COVID-19 IVD quality problems drive EC guidelines | #Regulatory Focus https://t.co/JnS72XIHRV
FloydPendergra3,2020-04-21 16:28:06,"California, USA",Twitter Web Client,,"Before CCP was killing people with Covid-19, they were killing people with fentanyl"
2foodie,2020-04-21 16:28:06,USA,Twitter for iPhone,,"Good news for me and my family.  Last week I tested positive for Covid antibodies, confirming I cleared the virus after weeks without symptoms.  I’ve also signed up for a clinical trial to donate my blood plasma and expect to make the donation in the coming weeks"
hutsonh,2020-04-21 16:28:06,"Bowdoinham, Maine",Twitterrific for Mac,,"A short story about why I love @waybackmachine.

I'll start with two pictures.  Spot the difference.

The first is the current correction on Richard Epstein's Covid-19 piece.  The second is a Wayback Machine capture of the correction on the piece as of 2.5 weeks ago. https://t.co/YHInWvxffT"
TCPalm,2020-04-21 16:28:06,"Treasure Coast, Florida",TCPalm News,,April 21: Treasure Coast gains just one new COVID-19 case overnight; no new deaths https://t.co/BRNzcI7vUm
roboticwrestler,2020-04-21 16:28:06,"Cambridge, MA",Twitter Web App,,"Proud to coauthor this with the brilliant @marylgray and godmother of AI, Barbara Grosz! How human-centered tech can beat COVID-19 through contact tracing https://t.co/8Fs0ryPdQJ"
balsamshore,2020-04-21 16:28:06,northeastern MN,Twitter Web Client,,These People Aren’t Freedom Fighters—They’re Virus-Spreading Sociopaths via @thenation https://t.co/dS3DLwhGhe
CeceinSwmn,2020-04-21 16:28:06,"Minnesota, USA",Twitter for Android,,"New this AM: Stacey Abrams and Andrew Yang announced Project 100, a campaign to provide direct cash payments to SNAP Families during the Covid crisis, with celebrity backers Ariana Grande, Rihanna, Halsey, Stephen Colbert, Julia Louis-Dreyfus and others. https://t.co/fFE2vvA9Ab"
stephenrblv,2020-04-21 16:28:06,Las Vegas NV USA,Twitter Web App,,So what are the odds Chris Cuomo is candid about his experience with COVID-19? How overblown it is and all that?
MoffittJill,2020-04-21 16:28:05,"Houston, Texas",Twitter for Android,,"@JohnRMoffitt 
Good article:
https://t.co/bqqZNm6rzW"
AgnesSolberg,2020-04-21 16:28:05,"Bismarck, ND",Twitter for iPhone,,UAE is not always an elective procedure even during a Covid pandemic.  Some patients cannot wait (HgB 3.8)! ⁦@ask4UFE⁩ ⁦@womenirads⁩ ⁦@TJUHospital⁩ ⁦@JeffersonRads⁩ https://t.co/YlutPvcuhu
RavenXandra,2020-04-21 16:28:05,"Dreamville, USA",Twitter for iPhone,,I really wish I could understand why people are protesting the stay at home orders that are designed to combat the spread of COVID-19. But then I think of natural selection 🤔 ... they got it
sexpospsych,2020-04-21 16:28:05,"Portland, OR",Twitter for Android,,"It blows my mind. We are at 75 days+ of dealing with COVID here in Vietnam,with 5 days of no new cases,and are sort of starting to hear about the possibilities of reopening things in the nearer future.Meanwhile other countries are like ""ok were below 1k deaths a day time to open"""
lvlvlrd707,2020-04-21 16:28:05,Republic of California,Twitter for Android,,"Dr. Birx is an Army Colonel and a subject matter expert who has dedicated her life to fighting infectious diseases.

Why shouldn’t she also be able to speak?
 
“Joe Biden: Dr. Anthony Fauci should be 'only person' public hears from during COVID-19 crisis”

https://t.co/K8AsHJLtdA"
Wait60mins,2020-04-21 16:28:05,"Calabasas, CA",Twitter for iPhone,,"Supreme COVID-19 Relief Box Logo Tee

$60

Friday, 11 AM EST. https://t.co/EIHsjuS4FH"
billingsgazette,2020-04-21 16:28:05,"Billings, MT",SocialNewsDesk,,"Montana reached 437 cumulative cases of COVID-19 on Tuesday, with 273 people recovered and 14 actively hospitalized. https://t.co/Iq99BU4pwO"
WOOPYA,2020-04-21 16:28:05,"Michigan, USA",Twitter Web App,,Do you think Michigan Gov. Gretchen Whitmer has done a good job navigating the state through the COVID-19 outbreak?
TKCTechnoHunter,2020-04-21 16:28:04,"Sandy, UT",Twitter Web App,,"@Allkeyshop join @globalgiving !  Fight the covid19 with the allkeyshop team

https://t.co/ld4c3oZ2Iy

#Allunitedagainstcovid19 #COVID--19 #staysafe #stayathome #GlobalGiving #coronavirus #confinement #Lockdown #Charity #Giveaway @foldingathome https://t.co/MxS204336K"
robbyberthume,2020-04-21 16:28:04,"Winston-Salem, NC",Twitter Web App,,"It was a pleasure joining @HeyOrca for their Agency Support Series on COVID-19. Humbled to be a guest!

https://t.co/4Ej1zzQzMO"
Thisthingwedo,2020-04-21 16:28:04,NY,TweetDeck,,"Thank you for all your kind words about the song, and for all your support for the Intensive Care Society, I tried a little at home version for you 💗 x x
https://t.co/wifTyYlz8o @ICS_updates https://t.co/apGEMqBUC2"
jaxbeachmarsh,2020-04-21 16:28:04,Northeast Florida,Twitter for iPhone,,"Ohio man, 60, who blasted COVID-19 ""stay-at-home orders are 'b*****t' dies after contracting the virus

In a Facebook post, he wrote: 

""Does anybody have the guts to say this Covid19 is a political ploy? Asking for a friend. Prove me wrong""

https://t.co/HVwqMXrj9Y"
rowansrose,2020-04-21 16:28:03,"Texas, USA",Twitter for Android,,"Thank you for all your kind words about the song, and for all your support for the Intensive Care Society, I tried a little at home version for you 💗 x x
https://t.co/wifTyYlz8o @ICS_updates https://t.co/apGEMqBUC2"
InfoBiter,2020-04-21 16:28:03,"Georgia, USA",Twitter Web App,,State of Georgia announces it is re-opening while they have 28-3 lead on COVID-19.
fantabulizer,2020-04-21 16:28:03,"Weird, sunny California",Twitter Web App,,can't wait for the Supreme Court to hold that COVID-19 is such an emergency that Trump can halt all immigration but not enough of an emergency to extend absentee voting in Wisconsin by 6 days
IHPEmory,2020-04-21 16:28:03,"Atlanta, GA",Twitter Web App,COVID19,"""religion has impacted and will continue to impact the COVID—19 response in myriad ways"" #COVID19, Religion and the Importance of Effective Leadership, John Blevins @IHPEmory &amp; JLI Board member on @LSE_RGS BlogL https://t.co/5cmE95pnQQ https://t.co/AKPNxmEavQ"
WomanProjectHQ,2020-04-21 16:28:03,"Rhode Island, USA",Twitter Web App,,"Wyatt Detention Center in Central Falls, RI, has at least one positive case of COVID-19 today according to credible reports, but we are unable to confirm. .@RIHEALTH has not yet responded to our inquiry from this morning.

Any info? .@UpriseRI .@NeverAgainRI"
Maur2009,2020-04-21 16:28:02,"Charlotte, NC",Twitter for iPhone,,"Now that word has gone out from the CDC to go back through your records and recode any deaths that looked even remotely like COVID-19 as a COVID-19 death, expect to see mini-one-day spikes in death counts from various states - just like we saw from NY.

Hospitals gotta get paid."
english_nu,2020-04-21 16:28:02,"Boston, MA",Twitter for iPhone,,"Wonderful piece by @nuhumanities Assoc. Director @SariAltschuler in @washingtonpost on what we can learn about using literature from cholera epidemics to help adjust tor realities of the current pandemic. @english_nu  
https://t.co/OvMYPklJ7j"
SGTheBestNest,2020-04-21 16:28:02,"Georgia, USA",Twitter Web App,,"[CORONAVIRUS: WHAT REOPENS WHEN?] Georgia is one of the first few states that will re-open with some businesses opening as early as this week. Here's what opens on Fri, Apr 24 &amp; Mon, Apr 27th. The shelter ends Apr 30. 

#georgia #covid #coronavirus #coronaviruspandemic #covid19 https://t.co/G0ywuLz7Dj"
SoVintage,2020-04-21 16:28:02,"Atlanta, GA",Twitter Web App,,COVID-19 hearing some States are opening public businesses as early as Friday. https://t.co/UQZl2wdRh4
CB4BlackGirls,2020-04-21 16:28:02,"Washington, DC",Buffer,"blackwomen, womensrights, cleanbeautyforblackgirls","Women (and the country) can't win without black women. 
Period.

#blackwomen #womensrights #cleanbeautyforblackgirls

https://t.co/2anbrlJigr https://t.co/LX6MVmZGSa"
LeighDarilek,2020-04-21 16:28:02,"San Antonio, TX",Twitter for iPhone,"covid_19, washyourhands, letcatstakenaps, catniphigh, 420FromHome, 420day","Sasha #covid_19 diaries - i got to eat grass on 4/20 . #washyourhands #letcatstakenaps. 

#catniphigh #420FromHome #420day https://t.co/DCXPSugNaV"
GoodAndGoldMKTG,2020-04-21 16:28:02,"Portland, OR and Beacon, NY",Twitter Web App,,"A very informative survey from @Yotpo about consumer behavior in a post-covid world... 
https://t.co/D8JO9mg8wR"
TJMacmusic,2020-04-21 16:28:02,"Fort Worth, TX",Twitter for iPad,,"According to new antibody tests, as many as 65 million Americans are already infected with COVID-19. That puts CFR at about 0.06%, or LESS THAN the flu.

You get that Liberal babies? Your precious COVID-19 is LESS DEADLY than the flu.

Trump is calling your bluff."
HotlineJosh,2020-04-21 16:28:01,"Washington, DC",Twitter Web App,,"One thing that strikes me about this chart -- referenced by @JVLast -- is that the states with more success in containing the virus aren't necessarily the states with the tougher stay-at-home orders.

MO, AR and OK success stories.
OH, CO, MN seeing spikes
https://t.co/1lgNtW4itd"
KaraMar111,2020-04-21 16:28:01,"Mission Viejo, CA",Twitter for Android,,"GOD, GOVERNMENT, AND THE GOSPEL
I signed up for this presentation before COVID-19. Timely. Churches are told not to assemble. Citizens forced out of work thereby breaking contracts, ruining credit, going bankrupt. Is this righteous gov't? Sign up! https://t.co/WFtMX2KBnd https://t.co/BBtEGpNP12"
RazorPack65,2020-04-21 16:28:01, USA,Twitter for Android,,"Fauci’s numbers are inflated, because many deaths have been attributed to COVID-19, despite the deceased not having been tested for coronavirus. And for example,if someone is at the last stages of cancer, and got this virus, then died they count this too.  https://t.co/aawnQlIzOP"
grump456,2020-04-21 16:28:01,"Longview, Texas",Twitter Web Client,,TDCJ’s Beto Unit in Palestine has 97 confirmed COVID-19 cases among inmates https://t.co/M6WDOdGFPU
KCD24,2020-04-21 16:28:01,"Oklahoma, USA",Twitter for Android,,"Ha!  Rush just asked a great question:

If a state like Montana were responsible for half of the covid deaths, instead of NYC, do you really think everybody else in the nation would be shutting things down? 🤔

My guess - HELL NO!"
Coach_Pertz,2020-04-21 16:28:01,"Middleton, WI",Twitter for Android,,@robreischel @wiaawi This data means nothing? Notice a pattern? https://t.co/vsHyRN3e1p
usamrdc,2020-04-21 16:28:01,"Fort Detrick, MD",Twitter Web App,KilltheVirus,"Army researchers contribute solutions to COVID-19 response. @usarmyccdc @armyfutures
#KilltheVirus

https://t.co/XTkWRq7crM https://t.co/niS89F7Rq5"
saugarmaripuri,2020-04-21 16:28:01,"Minneapolis, Minnesota",Twitter for iPhone,,"To early to make conclusions, but Minnesota COVID-19 hospitalization census has leveled off around 240 patients for the past 4 days. ICU level care has shown signs of leveling too. Previously we had consistent growth for over 2 weeks. Source: MDH https://t.co/hSXXnbp9zI"
sherrissecret1,2020-04-21 16:28:00,"New York, USA",Twitter for iPhone,,"New this AM: Stacey Abrams and Andrew Yang announced Project 100, a campaign to provide direct cash payments to SNAP Families during the Covid crisis, with celebrity backers Ariana Grande, Rihanna, Halsey, Stephen Colbert, Julia Louis-Dreyfus and others. https://t.co/fFE2vvA9Ab"
MoneywhoreTrump,2020-04-21 16:28:00,"Washington, DC",Twitter for iPhone,,"This morning nurses protested for PPE - in front of the White House.

They read the names of healthcare workers who have given their lives trying to save others from COVID-19.

And the list felt endless.

This situation is unacceptable. We need to support our nurses. Now. https://t.co/jKl4JpKP3L"
kcpels,2020-04-21 16:28:00,"Boston, MA",Twitter Web App,,A sign of how hopelessly sclerotic and visionless our country has become that no cities in the USA are planning something similar and just plan to go back to the same (or worse) congestion and pollution after the Covid shutdown lifts. https://t.co/3QzFnuwzmJ
NeilRetail,2020-04-21 16:28:00,"Scottsdale, AZ",Buffer,,"🇺🇸 Cola-Cola posted first-quarter revenue down 1% from a year earlier, with sales growing for the first two months of the year before the Covid-19 pandemic escalated https://t.co/2bXZj8ADXw"
Ninidope_,2020-04-21 16:28:00,"California, USA",Twitter for iPhone,,"I’m not one to usually ask for things like this but I could REALLY use your help. I lost my great grandmother, my uncle and my aunt all within 2 weeks due to COVID-19. Any contribution is highly appreciated by my family even if it’s just a simple retweet🤍
https://t.co/2Y5Jryhxqj"
InLWithLBeingL,2020-04-21 16:28:00,"Maine, USA",Twitter for iPhone,,"While L.A. County reports total of 13,816 coronavirus cases, antibody study shows hundreds of thousands more could have had COVID-19 in the past https://t.co/rJjgQGqjVK"
Mrstayinyourla1,2020-04-21 16:28:00,"Bronx, NY",Twitter for iPhone,TrumpVirus,"Yesterday Georgia had an all -time daily record  of 1,242 new #TrumpVirus cases and 94 deaths.  To celebrate, Governor Kemp decide to open the state for business.    https://t.co/iDwlwMnsnB"
boisemayor,2020-04-21 16:28:00,"Boise, Idaho",Twitter Web App,EarthDayBoise,"Hello Boise! Due to COVID-19 we are celebrating Earth Day, which is tomorrow, virtually. We’re asking the community to get creative in celebrating nature – plant flowers, create sidewalk chalk art, or go for a walk. Make sure to use the hashtag #EarthDayBoise in your posts. https://t.co/IvIz6LJYkt"
KenKraftNV,2020-04-21 16:27:59,"Las Vegas, NV",Twitter for iPhone,,This is why we can’t have nice things. We’ve already moved on from hydroxychloroquine as an effective COVID-19 treatment. https://t.co/2cCCj719n0
guye_guion,2020-04-21 16:27:59,Harlem NY,Twitter Web App,,Imagine Hurricane Katrina during a pandemic. The US needs to prepare for that — now. https://t.co/sBDcLEeR6O
daanvanesch,2020-04-21 16:27:58,"Leiden, NL / Mountain View, CA",Twitter for Android,,"Speaking of multilingual info about COVID-19, our listing of public health resources now includes 328 languages - thank you so much to all who have shared translated materials from their organizations! 🙌 https://t.co/jivSnIS3iM"
Disciple9208,2020-04-21 16:27:58,"Hangtown, California, USA",Twitter for Android,,"WTF happened to this  country

These Dems turned our country into a shithole

No Police Raids? Syracuse Mosque Continues Holding Daily Prayers Amid COVID-19 Lockdown As Christians Are Threatened &amp; Fined For Attending Drive-In Services 😈
https://t.co/Qb8lUSEUTf via @gatewaypundit"
DrChrisNicholas,2020-04-21 16:27:58,"Buffalo, NY",Twitter for iPhone,,"Anyway this has a happy ending, I explained the above logic as well as the fact that two extra unnecessary trips to the pharmacy amidst covid-19 is stupid, as this problem will fix itself whenever insurance decides to call them back. They agreed."
BarbaraMain07,2020-04-21 16:27:58,"Del Mar, CA",Twitter for iPhone,,"To All the healthcare workers &amp; everyone else who are on the front lines of COVID-19 pandemic. You are True American Hero's. Thank you for your service,  I'm a veteran &amp; Yes ur in harm's way. You are Hero's♥️♥️Thank you &amp; Be safe. Sincerely the American people 👇, https://t.co/hXhwRzQGQn"
thegr8juan_2,2020-04-21 16:27:58,"Arizona, USA",Twitter for iPhone,,"""An Ohio man who dismissed the coronavirus pandemic as a 'political ploy' and ripped his state’s lockdown as 'bullshit,' has died of COVID-19, according to reports. https://t.co/LepwEDkbGk"
vrosalia2,2020-04-21 16:27:58,"Colorado, USA",Twitter for iPad,,"The desire for cheap labor dovetailed w/dumb American ideas about Chinese Communist Party, which produced decades worth of lies. COVID-19 reveals that America is big loser and winners are CCP &amp; US elites. https://t.co/JINnveQCFq"
BrentFleer,2020-04-21 16:27:58,Omaha. Nebraska,Twitter for Android,,"Trish Stratus, Mickie James, Lita, and others thank frontline workers.

https://t.co/8AihUGKqGt https://t.co/3bpGxUBOdm"
abi_wilcoxson,2020-04-21 16:27:58,"Michigan, USA",Twitter for iPhone,,"Coach Molly Collins has always found ways to get creative for her students and athletes. Now she is going virtual to keep the softball season alive! @p3collins 

https://t.co/AY8FxDieC5"
gorgiasio,2020-04-21 16:27:58,"San Francisco, CA",Twitter Web App,,"Looking forward to sharing insights with @ReChargePayment &amp; @gorgiasio this Thursday at 4pm (BST). 

Join us for a casual conversation about subscriptions including the latest trends we're seeing with Covid-19 &amp; general best practices.

Sign Up: https://t.co/L9rwOle4Vy
#Webinar"
JohnDan21317417,2020-04-21 16:27:58,"Candler, NC",Twitter for Android,,"Before CCP was killing people with Covid-19, they were killing people with fentanyl"
katreese_,2020-04-21 16:27:58,"Durham, NC",Twitter for iPhone,,LabCorp at-home COVID-19 test kit gets FDA emergency authorization https://t.co/TDEuI9760V
DrHalee,2020-04-21 16:27:57,"Denver, CO",Twitter Web App,"telehealth, COVID19","How do practices optimize #telehealth after its rapid deployment amidst #COVID19? Join us tomorrow (4/21) for a joint webinar with @theAMGA and MGMA's SVP of Government Affairs, @AndersGilberg, as we discuss best practices with members from AMGA and MGMA: https://t.co/lC6FRlsx25 https://t.co/Rip2O3QyuZ"
AkEEmdahDrEaM,2020-04-21 16:27:57,"New York, NY",Twitter for Android,,"It blows my mind. We are at 75 days+ of dealing with COVID here in Vietnam,with 5 days of no new cases,and are sort of starting to hear about the possibilities of reopening things in the nearer future.Meanwhile other countries are like ""ok were below 1k deaths a day time to open"""
EmilyBemily88,2020-04-21 16:27:57,"Dayton, OH",Twitter for iPhone,,@Bromswell Trump is actively trying to protect companies from lawsuits if their workers get sick  https://t.co/XYjR8vsdUM
kenayers8,2020-04-21 16:27:57,"Bandon, OR",Twitter Web App,,"COVID-19 deaths reported per million inhabitants

New York 989
Belgium 518
New Jersey 493
Spain 455
Italy 399
Connecticut 372
France 310
Louisiana 285
Massachusetts 265
UK 255
Michigan 248
Netherlands 229
Sweden 175
Pennsylvania 105
Illinois 105
Denmark 64
Iran 63
Norway 34"
DailyCaller,2020-04-21 16:27:56,"Washington, DC",Twitter for iPhone,,"MUST-READ: ""Trump Says He’ll End Obama-Era Funding To Chinese Lab That May Have Spawned The Coronavirus""

(@DailyCaller @DavidKrayden)

https://t.co/Nf7Tvr2RGF"
PollyPapaya,2020-04-21 16:27:56,"Fort Lauderdale, FL",Twitter for iPhone,"OneVoice1, OVTTDS","Developing safer, faster ways of testing. Thank you
#OneVoice1
#OVTTDS

This robot could make COVID-19 testing faster and safer https://t.co/7EdSwf8XJ0 via @CNET"
HillTownTrader1,2020-04-21 16:27:56,"Montana, USA",Twitter Web App,,"@percy_gryce @pojanowski I agree. Covid has spread &amp; will spread. We can be hygienic, safe AND work - these aren't mutually exclusive. We now have good data to identify high-risk ppl w/ co-morbidities. Let's protect them while low-risk ppl work &amp; develop inevitable herd immunity. Hospitals have capacity."
KingDavidFilms,2020-04-21 16:27:56,"California, USA",Twitter for iPhone,,Everyone seeking to understand the extent of Trump’s botched response to COVID-19 must recognize that Trump wasted one of the country’s best weapons to fight a pandemic: The Strategic National Stockpile of protective equipment. https://t.co/5ABsuqCZnr
