screen_name,created_at,location,source,hashtags,text
Jan3537,2020-04-21 16:10:11,"Kentucky, USA",Twitter for iPhone,,"Pelosi is so out of touch with reality Her actions at the State of the Union Speech, were outrageous &amp; definitely showed Americans she is not a stable individual serving our Country. Pelosi called everything a lie in the President’s speech. Covid 19 was in the President’s speech https://t.co/tBNBo2FUeU"
DSnyd1,2020-04-21 16:10:11,"New Jersey, USA",Twitter for Android,,"im so sick of the “ThE fLu KilLed 37,000 PeOplE” headasses....okay covid-19 killed 42,000 people in 3 months....we still have the rest of the year &amp; normal flu season ahead of us. you’re not being educated you’re being purposely dense."
WRFGatlanta,2020-04-21 16:10:11,"Atlanta, GA",Hootsuite Inc.,"WRFG, Trump, Coronavirus","#WRFG  Show co-host Juan González gives an update on his mother &amp; wive who were infected with COVID-18, and talks about #Trump supporters who are holding protests to end #Coronavirus shutdowns. The story at 5:00 pm on Democracy Now! with Amy Goodman.
https://t.co/XWGmNMZQXO"
JP70332937,2020-04-21 16:10:11,"St. Louis, MO",Twitter for Android,,"What do @AndrewYang, @staceyabrams, @ArianaGrande, @playercoalition, @halsey, &amp; @rihanna's @ClaraLionelFdn have in common? They're all supporting today's #Project100 launch: a $100m effort to send cash directly to Americans. #UBI #COVIDrelief https://t.co/qVUiwkuGKX"
TDKTechnologies,2020-04-21 16:10:11,"St. Louis, Missouri",Hootsuite Inc.,"wfh, IT","Fortune: As businesses adapt to remote work, tech isn't their biggest problem
https://t.co/qnJFgiiXQ8 #wfh #IT https://t.co/rY2qaR6Tra"
R_Rodriguez_27,2020-04-21 16:10:11,NJ,Twitter for iPhone,,My cousin tested positive for COVID-19 so I asked how he’s doing forgetting how dramatic Dominicans are: https://t.co/vCJqCrzx8m
schitter,2020-04-21 16:10:10,"Los Gatos, CA",Twitter for iPad,,Michigan residents favor governor's COVID-19 handling over Trump's https://t.co/21k8ab1YyL https://t.co/4HELCUR6my
_johnbyrne,2020-04-21 16:10:10,"City Hall, Chicago, IL",Twitter Web App,,Budget Committee back on. Public testimony opens with frequent speaker George Blakemore phoning in. He laments the high rates of COVID-19 in black community. Calls on aldermen to make sure federal funding goes to help black neighborhoods and residents.
rdreynola,2020-04-21 16:10:10,Louisiana,Twitter for iPhone,,"TOMORROW 8/7c, we rally for US! Don’t miss 'Saving OurSelves: A BET COVID-19 Relief Effort' hosted by Terrence J and more on BET.

1️⃣ Set Your Reminder Below 👇🏾
2️⃣ Watch and Live-Tweet with us using #BETCovidRelief to help make an impact! https://t.co/gtiG2PaHJD"
Gargoyle65,2020-04-21 16:10:09,"Arlington, VA",Twitter for iPhone,,Heavily armed protestors in Pennsylvania demonstrating against protecting Americans from COVID-19 think military grade weapons will protect them from imaginary threats in their heads. Playing dress-up during a pandemic while endangering public safety should result in big fines. https://t.co/Ec90JZyenb
CourtneyJohnsTV,2020-04-21 16:10:09,"Omaha, NE",TweetDeck,,"Iowa is launching “Test Iowa.” This public/private partnership will make 3,000 additional covid-19 tests available daily."
BrianHedger,2020-04-21 16:10:09,"Columbus, OH",TweetDeck,s,"@Agalloch84 We have hard data. Facts. 

And despite the death count in the U.S. surpassing 40,000 (as reported by state governments to the CDC), they're low estimates, because almost nobody is tracking nursing home COVID-19 deaths.

The #s are going to skyrocket if we just ""open it back up."""
HADCFoundation,2020-04-21 16:10:08,"Naples, FL",Hootsuite Inc.,,Insulet Expands Financial Assistance for Omnipod Users During COVID-19 https://t.co/huDQoOTUVe
telarus,2020-04-21 16:10:08,"Sandy, UT",Hootsuite Inc.,,"Click here to see how 43 Contact Centers responded to COVID-19 with SmartAction.  
https://t.co/Q2mxz1RkWB"
WhatsWrongWhit,2020-04-21 16:10:08,"Maryland, USA",Twitter for Android,"MECFS, covid",I spoke with @RepSarbanes 's office today about this issue and how #MECFS has impacted me. The diagnostic delay caused what could have been mild ME to become moderate-severe. We can't let this happen to people who may become chronically ill after #covid ! Thank you for listening!
HealioPulm,2020-04-21 16:10:08,"Thorofare, NJ",Hootsuite Inc.,"chloroquine, COVID19",From @InfectDisNews: High-dose #chloroquine trial for #COVID19 halted due to increased fatality rates https://t.co/i11qjhoEvP
AJSchraff56,2020-04-21 16:10:08,"Cincinnati, OH",Twitter for iPhone,,"If you could end Covid-19 by sacrificing one NHL team, which team would you choose and why Pittsburgh?"
Elmayimbe__,2020-04-21 16:10:08,"Ohio, USA",Twitter for iPhone,,My cousin tested positive for COVID-19 so I asked how he’s doing forgetting how dramatic Dominicans are: https://t.co/vCJqCrzx8m
BigCtheEG,2020-04-21 16:10:08,West Virginia,Twitter Web App,,If the Redskins get new uniforms and they suck it would be more devastating for me than if COVID takes my life.
bigrich6650,2020-04-21 16:10:08,"Milan, Michigan",Twitter for iPhone,,Israelis just showed the world what a socially distant protest looks like https://t.co/B9Qow2lErG
athena540,2020-04-21 16:10:08,Virginia,Twitter Web App,,"Before CCP was killing people with Covid-19, they were killing people with fentanyl"
sandyj1967,2020-04-21 16:10:08,Nevada,Twitter for iPhone,,"PEOPLE ARE SCOURING THEIR EMAILS AND FINDING OUT SHIT

THEY JUST FOUND STUFF RELATING TO HIV BEING SPLICED INTO COVID-19

LMFAO

THIS IS BIG https://t.co/z3zwp72RYM https://t.co/BT3xRZIUM5"
deplorableBob63,2020-04-21 16:10:07,"Naples, FL",Twitter for iPhone,,COVID-19 'Survivor' Chris Cuomo And CNN Pretend He Just Left His Basement. But He Was Berating A Bicyclist On Easter Sunday. https://t.co/hFcg6diu5d via @gatewaypundit
Steven_R_Stice,2020-04-21 16:10:07,"Galena, KS",Twitter for Android,,"President Trump now seeks to distract us from his fumbled COVID-19 response by trying to put the blame on immigrants. The truth is many immigrants are on our front lines, protecting us as doctors, nurses, health aids, farmworkers, and restaurant workers. https://t.co/nJef4W5qZK"
Heerak4Congress,2020-04-21 16:10:07,"Arlington, Virginia",Twitter Web App,,"Is New York's food source in jeopardy? Watch video on pinned tweet at top to see why USA &amp; UK are in trouble, but why Asia is not! @nytimes @nypost @adamgoldmanNYT @NydiaVelazquez @nytdavidbrooks @nytmike @EricLiptonNYT @SangerNYT @jwpetersNYT @SkyNews @EW
https://t.co/oIGnIZVMtG"
bamanewsnow,2020-04-21 16:10:07,"Alabama, USA",Bama News Now,"Coronavirus, coronavirus, COVID","At the Peak of the #Coronavirus

By: Bradley Byrne

National and state officials agree that we have reached the peak of new cases and deaths here in Alabama from the #coronavirus called #COVID-19. What does that mean? It means that the number of new daily cases and daily dea... https://t.co/YIYxzIwFKr"
ChiHearing,2020-04-21 16:10:07,"Chicago, IL",Hootsuite Inc.,,Read an update from our team at Chicago Hearing Services on our blog: https://t.co/3FOxDtQ3i2 https://t.co/ZfAuny1Ei0
johnnydriscoll,2020-04-21 16:10:07,Holyoke Massachusetts,Crowdfire App,,‘A very dangerous political game!’ Trump lashes out at governors demanding more COVID-19 tests https://t.co/o56i5iI9D7
HealTheBay,2020-04-21 16:10:07,"Los Angeles, CA",Hootsuite Inc.,publichealth,"The oil and gas industry is requesting the @EPA ease enforcement of air and water pollution regulations during the COVID-19 pandemic. But these environmental protections are in place to protect #publichealth!

https://t.co/JAqQ1g10Uc https://t.co/oMAUlBPjFb"
D_Eric_L,2020-04-21 16:10:06,"Behind enemy lines, USA",Twitter for Android,,"Modern day Christian persecution...change my mind. 😡🤬😤😢

No Police Raids? Syracuse Mosque Continues Holding Daily Prayers Amid COVID-19 Lockdown As Christians Are Threatened and Fined For Attending Drive-In Services https://t.co/0hRr0ZVUqm"
YCM_Security,2020-04-21 16:10:06,"Virginia, USA",Buffer,"cybersecurity, COVID__19","Coronavirus sparks phishing, disinformation, tabletop exercises and handwashing. https://t.co/kgpQtT8mVl ""A State Department official told Congress Thursday that Russian operatives are behind coronavirus conspiracy theories popping up on social media."" #cybersecurity #COVID__19 https://t.co/3ObTqLuYT2"
strangetikigod,2020-04-21 16:10:06,"San Jose, CA",Tweetbot for Mac,,Senate Democrats want more aid for the states and cities hardest hit by the COVID-19 pandemic. Republicans don't. Why? Trump hopes he can use the aid as leverage to get states to open up sooner. It's not about our health or our safety. https://t.co/KrXmmXyfQk
jimbevard,2020-04-21 16:10:06,"Virginia, USA",Twitter for Android,,"Dr. Birx is an Army Colonel and a subject matter expert who has dedicated her life to fighting infectious diseases.

Why shouldn’t she also be able to speak?
 
“Joe Biden: Dr. Anthony Fauci should be 'only person' public hears from during COVID-19 crisis”

https://t.co/K8AsHJLtdA"
NaesNoslenn,2020-04-21 16:10:06,"San Antonio, TX",Twitter for iPhone,,29 positive COVID-19 cases in Bexar County Jail
FutureWorkforce,2020-04-21 16:10:06,San Diego CA,Scoop.it,,Hats off to Cushman for the free 32-page return-to-work guide https://t.co/cWoMfHH6Oz https://t.co/qQhhEUFDuC
WPUHockey,2020-04-21 16:10:06,"Wayne, New Jersey, USA",Twitter for iPhone,Jersey4Jersey,"Tomorrow at 7 pm, #Jersey4Jersey, a one-night broadcast fundraiser to fight the impact of COVID-19 in New Jersey will take place and be simulcast on the Devils Hockey Network featuring artists such as @springsteen &amp; @BonJovi

#WeAreTheOnes | #JerseyStrong

https://t.co/hqkAGWpcc9"
MiTeGen,2020-04-21 16:10:06,"Ithaca, NY",Zoho Social,"crystallography, cryoem",Our April Newsletter Is Out - Features SARS-COV-2 / COVID-19 Resources and Priority Support - Online #crystallography and #cryoem Events - Learning Resources For Researchers - Article Comparing Serial X-ray Crystallography and MicroED - And More https://t.co/BH31vDnxJM https://t.co/UdLRRRf5l0
FKTVis,2020-04-21 16:10:05,"New York, USA",Twitter Web App,,"It gets worse for the CDC. We knew the CDC sent out ""bad"" test kits. Now we know the kits were actually infected with COVID-19. And it wasn't a failure at a single lab.

At least 2 of the 3 labs that prepared and shipped these kits, sent infected ones.
https://t.co/oCwRpyg0Jb"
jmac6094,2020-04-21 16:10:05,"California, USA",Twitter for iPhone,,"Los Angeles county health Dept and USC release preliminary results showing the COVID infections are MUCH higher in LA than reported, meaning 2 things: 

1) mortality rate FAR lower than the estimate (&lt;1%) ...

https://t.co/5PEHVxveVT"
MYsurance,2020-04-21 16:10:05,"Glen Ellyn, IL",Hearsay Social,,"Digital ad credits, videoconferencing services, cybersecurity tools and more - check out the free resources collected in this article for small businesses impacted by COVID-19. Via Inc. https://t.co/SfAD3n3Qoh https://t.co/mPIhoP7gq4"
JackRJr76,2020-04-21 16:10:05,"Tennessee, USA",Twitter for iPhone,,"@DonaldJTrumpJr This is ignorant we couldn’t even maintain our own ppe, and China had to send us some but let’s sue them because that’s going to stop COVID-19. Idiots."
BlackHillsFOX,2020-04-21 16:10:05,"Rapid City, SD",SocialNewsDesk,,"COVID threatens US pork, beef supplies https://t.co/dP3MWPVKdf"
JusticeRestore,2020-04-21 16:10:05,"Illinois, USA",Hootsuite Inc.,"Twill, FlattenTheCurve, ReleaseOurElders, StopCovid19InPrisons","We've compiled important information about COVID-19 and prisons. Find articles about the situation, forms for family members and loved ones, and other important information. #Twill #FlattenTheCurve #ReleaseOurElders #StopCovid19InPrisons https://t.co/pKbtzXnVDU"
LocalArtisanINK,2020-04-21 16:10:05,Wisconsin,Twitter for iPhone,,"Even though this covid stuff is going on we will still be pushing out interviews and podcast for all you guys, thank you so much for rocking with us for all this time!!!"
Nadiai67,2020-04-21 16:10:05,"Los Angeles, CA",Twitter for Android,,"Officials in Wisconsin have traced at least 7 positive COVID-19 cases back to in-person voting for the April 7 election (key phrase being *at least*) in Milwaukee. The city, which usually has 180 polling locations, operated with just 5 on election day https://t.co/aNq7J2aDub"
momsrod_janet,2020-04-21 16:10:05,"Oregon, USA",Twitter for Android,,"This morning nurses protested for PPE - in front of the White House.

They read the names of healthcare workers who have given their lives trying to save others from COVID-19.

And the list felt endless.

This situation is unacceptable. We need to support our nurses. Now. https://t.co/jKl4JpKP3L"
JeffreyPJacobs,2020-04-21 16:10:05,"Greenville, SC, USA",Hootsuite Inc.,"TheBrandProtector, ShowUpAndThrowUp, PromoJournal","The latest #TheBrandProtector suggests #ShowUpAndThrowUp. It's a trick used to beat writer's block, but it might work in other parts of your COVID-19 life. https://t.co/75gu3qd2IO @promocorner #PromoJournal https://t.co/FcksObCewT"
nswint,2020-04-21 16:10:05,"Silver Spring, MD",Google,,Peloton will resume live-streaming from instructors’ homes after finally closing its studios https://t.co/F2fglGwDhA
thesubtimes,2020-04-21 16:10:05,"Lakewood, WA",WordPress.com,,Central Pierce County Congregate Care facility experiences high number of COVID-19 cases https://t.co/a6YOKEzmUA
DowntwnGreenway,2020-04-21 16:10:05,"Greensboro, NC",Hootsuite Inc.,"Vanguard, GSO","The Downtown Greenway is part of #Vanguard conference! We're excited to have so many young community leaders from across US in #GSO experiencing our work &amp; sharing their ideas.
Conference sched for May 2020 but due to COVID-19, rescheduled for Sept 14-17
https://t.co/gSA5srSOdg https://t.co/NwKy3mNOz2"
gregpiper,2020-04-21 16:10:04,"Washington, DC",Twitter for Android,WWII,"Very interesting, but there's also this buried in the middle: ""It appears that most Covid-19 patients experience relatively mild symptoms and get over the illness in a week or two without treatment."" It's not #WWII, as fascist governors keep screeching. https://t.co/sPtSeDwobS"
GayUSAPages,2020-04-21 16:10:04,USA,Hootsuite Inc.,LGBTQ,"Many artists, including Cyndi Lauper &amp; Troye Sivan, are set to appear in a live-streamed concert benefiting the #LGBTQ Nightlife Community April 23rd. https://t.co/bUVkSigrP1"
mrkennedy_pccsd,2020-04-21 16:10:04,"Ohio, USA",Twitter for iPhone,,"High school Seniors: as you proceed to college (bummer on Covid and graduation 😒) please remember what you learned about RESPECT. The time to address an adult by their first name is when they GIVE YOU PERMISSION. Until that day —Sir, Ma’am, Mr, and Mrs/Miss always works!"
DrEboniHaynes,2020-04-21 16:10:04,"Atlanta, GA",Hootsuite Inc.,"COVID19, MentalHealth",The Implications of COVID-19 for Mental Health and Substance Use | https://t.co/s91vlSnmJr #COVID19 #MentalHealth
LindstromCheryl,2020-04-21 16:10:04,"Albertville, MN",Twitter Web App,,"Every goddamn day trump tells the lie that he ""inherited a broken and obsolete system.""

1. You've been there for 3.5 years
2. There was no COVID before you
3. You gave away 18 tons of PPE to China while saying ""it's under control"""
visitchapelhill,2020-04-21 16:10:04,"Chapel Hill, NC",Twitter Web Client,,App boosts business at Ramble Rill farm in Hillsborough despite COVID-19 pandemic https://t.co/RYF6MCCWkd via @ABC11_WTVD
JustWantHealth,2020-04-21 16:10:04,"Washington, USA",Twitter for iPhone,,"By and large, the same habits that put us at high risk from covid put us at high risk from dying of chronic illness, it's just less glamorous and more profitable.  Time to get responsible."
cenmag,2020-04-21 16:10:04,Washington DC,Hootsuite Inc.,COVID19,The NIH forms a partnership with multiple federal agencies and pharmaceutical companies to coordinate swift response to the #COVID19 pandemic. https://t.co/QxZSftAbbe
FamilyVoices,2020-04-21 16:10:04,"Albuquerque, NM",Hootsuite Inc.,,"Wednesday, April 22nd, 10-11:30am - An informative 90-minute conversation exploring equity and access in out-of-school time/after school humanities programming for youth ages 12 - 18 during the COVID-19 crisis. Register at this link: https://t.co/HcB1UqMALe"
SummitSheriffCO,2020-04-21 16:10:04,"Summit County, Colorado",Twitter for iPhone,,"Testing for COVID-19 is available beginning tomorrow, Tuesday, 4/21, and Thursday, 4/23. If you have symptoms, email summitcovidscreening@vailhealth.org, in English or Spanish, with your name and phone number. A person will call you back in 24 hours to set up an appointment. https://t.co/3J5LAuWcJ5"
CI_Fishers,2020-04-21 16:10:04,"Fishers, Indiana",Hootsuite Inc.,,From the mayor: Scott Fadness answers city-related questions about the effect of the COVID-19 pandemic | Current Publishing https://t.co/pOpbRIUXDU
KaporCapital,2020-04-21 16:10:04,"Oakland, CA",Sprout Social,"KaporPortfolio, KaporCapital",COVID-19 Resource: @blokable is creating and delivering accessible quarantine units to help the Washington State Department of Health house at-risk individuals in their local communities. https://t.co/zms6CYmxeo #KaporPortfolio #KaporCapital
MarkGraban,2020-04-21 16:10:04,"Fort Worth, TX and Orlando, FL",Twitter Web App,,"Make the Essentials😷
Harry Moser on the COVID-19 Supply Chain Wake-Up Call🔥 @MarkGraban https://t.co/zwoEakbRsX 
#manufacturingpayswell #totalcost"
KristaKaine,2020-04-21 16:10:04,"Valrico, FL",Twitter for iPhone,"GovRonDeSantis, POTUS, realDonaldTrump","Perhaps that explains why my daughter was FIRMLY diagnosed (by TWO doctors at TWO different places) as having Covid 19, when in fact, she has bacterial pneumonia, secondary to some other virus.
#GovRonDeSantis #POTUS #realDonaldTrump"
BillieKennedy,2020-04-21 16:10:03,Alabama,Twitter for iPhone,,"I'd like to point out that Mo Brooks put together a covid committee to represent all of District 5. That's 5 counties. Nearly 750,000 people. And not one black or brown person on his committee. Also, no Asians. Despite Asian companies being 1 of the largest employers in the area"
mrpinkoutloud,2020-04-21 16:10:03,"Chicago, IL",dlvr.it,,"Troye Sivan, Kim Petras &amp; More Confirmed for Stonewall Livestream Concert https://t.co/fhecvDRJTV https://t.co/3mTLsjWfkm"
lellingw,2020-04-21 16:10:03,USA,Twitter for iPhone,,"We will make reopening decisions in New York State on a regional basis.

We recognize not all regions are impacted with COVID-19 in the same way. 

It's the logical thing to do."
okstate_ag,2020-04-21 16:10:03,"Stillwater, Oklahoma",Sprout Social,"CheersToVolunteers, NVW2020","Oklahoma Home and Community Education (OHCE) members and @okstate Extension Family and Consumer Sciences Master Volunteers have been busy! Since the COVID-19 outbreak, they have sewn 20,000+ face masks for Oklahomans.

🔗: https://t.co/2KrSQLC8zq

#CheersToVolunteers | #NVW2020 https://t.co/sJo08XfxmZ"
bIu3b1rd,2020-04-21 16:10:03,"San Jose, CA",Twitter for Android,,can't wait for the Supreme Court to hold that COVID-19 is such an emergency that Trump can halt all immigration but not enough of an emergency to extend absentee voting in Wisconsin by 6 days
kotatweets,2020-04-21 16:10:03,"Rapid City, SD",SocialNewsDesk,,"COVID threatens US pork, beef supplies https://t.co/GVWZdV46Hj"
NYBizDaily,2020-04-21 16:10:03,"New York, NY",Twitter Web App,"jobs, hiring, temps, stores, retail, wmt, samsclub, covid","Walmart to hire 50,000 more temporary workers, requires facemasks for all workers. @walmart #jobs #hiring #temps #stores #retail #wmt #samsclub #covid https://t.co/tguPdJgLLW"
TrinaSolarUS,2020-04-21 16:10:03,"Silicon Valley, CA",Sprout Social,PVsolar,China export data for March 2020 has indicated a major rebound in #PVsolar panel exports as manufacturers ramped production after the extended New Year and travel restrictions caused by the COVID-19 pandemic: https://t.co/ZiMSMDBgOV
DStellato1013,2020-04-21 16:10:03,Virginia USA,Twitter for iPhone,,@miguelmarquez This truck full of idiots was voted most likely to be dead of COVID-19 by the end of May.
jmdtweet,2020-04-21 16:10:03,"California, USA",Twitter for iPhone,,"This morning nurses protested for PPE - in front of the White House.

They read the names of healthcare workers who have given their lives trying to save others from COVID-19.

And the list felt endless.

This situation is unacceptable. We need to support our nurses. Now. https://t.co/jKl4JpKP3L"
mediaoccident,2020-04-21 16:10:03,"Wisconsin, USA",Twitter Web App,,NBC News/WSJ poll: 58% Americans think COVID-19 restrictions will be lifted too soon https://t.co/RgXoqnbedi
mpho_pitsi_SA,2020-04-21 16:10:02,"Los Angeles, CA",Twitter for iPhone,listentotheexpert,"#listentotheexpert
Testing for Covid-19 has been intensified during our lockdown. 
Prof Koleka Mlisana from the NHLS tells us why testing during lockdown is crucial. https://t.co/yewBaNu9Dy"
Mintz_Law,2020-04-21 16:10:02,"Boston, MA",Sprout Social,"COVID19, venturecapital, VC",Join us on 4/30 for a webinar on Planning Your Next Round of Financing in Light of #COVID19. @Mintz_Law attys &amp; #venturecapital leaders will discuss practical steps #VC–backed companies can take to prepare for their next round of financing. RSVP today! https://t.co/9PIEOwGCWL https://t.co/GusTLpuOdY
virani_md,2020-04-21 16:10:02,"Texas, USA",Twitter for iPhone,COVID19,"Patients with #COVID19 may have elevated electrocardiogram readings but no signs of arterial blockage, research indicates. #ACCPrev Chair Dr. @virani_md spoke with @modrnhealthcr: https://t.co/5rj3CipWYQ"
lerouxlindsey,2020-04-21 16:10:02,"Hudson Valley, NY",Twitter Web App,,"There is a way to safely reopen by summer, and stay open. It won’t be easy but it can be done. https://t.co/KCYF1ix82C"
s_schulte,2020-04-21 16:10:02,"Columbus, OH",Twitter for iPad,,"Larry Householder's hand-picked task force charged with drafting a plan for economic recovery has devolved into an open platform for the airing of grievances against the government and unemployed Ohioans. 

https://t.co/Wqkf71Ht1N via @ohiocapjournal"
FD_Tyranny,2020-04-21 16:10:02,USA,FD Tyranny,PatriotPowerHour,"Checkout the latest #PatriotPowerHour (Episode 92)
COVID has yet to peak, and its economic and cultural impact has just begun to be felt. PPH continiues to chronicle news and trends, while defending the Bill of Rights
https://t.co/wibOrZTKXd https://t.co/PEMoQYXETb"
Catenigma,2020-04-21 16:10:02,"Michigan, USA",Twitter for iPhone,,"This morning nurses protested for PPE - in front of the White House.

They read the names of healthcare workers who have given their lives trying to save others from COVID-19.

And the list felt endless.

This situation is unacceptable. We need to support our nurses. Now. https://t.co/jKl4JpKP3L"
PennCapitalStar,2020-04-21 16:10:01,"Pennsylvania, USA",Twitter Web Client,"COVID19, coronavirusupdates","BREAKING: Fully updated with our map and tracking graphics: The latest on #COVID19 in Pa.: 34,538 confirmed cases in 67 counties https://t.co/k9C2xv9M4n via @penncapitalstar #coronavirusupdates"
ChoiceMediatv,2020-04-21 16:10:01,"Hoboken, NJ",Buffer,"Voices4Ed, EdChat","PODCAST: COVID-19 and the Future of Education (ft. Jeb Bush)

@edu_post @lanewrightme @citizenstewart @JebBush #Voices4Ed #EdChat

https://t.co/YPzvMxdbSX"
MrMarleyMar,2020-04-21 16:10:01,Idaho,Twitter Web App,,"😳FINES &amp; JAIL TIME if you don’t stay IN YOUR HOUSE...

....unless you’re part of the deep state high society club that is. 💁‍♀️

👉🏻George Stephanopoulos Walking in the Hamptons After COVID-19 Diagnosis👈🏻
https://t.co/7MzkjZ8Fhf"
obx1957,2020-04-21 16:10:01,Outer Banks NC,Twitter for iPad,,"Less than one tenth of one percent of people that contract COVID-19 will die from it.

If you don’t think Democrats have turned this into a political opportunity to destroy Donald Trump with lies, misinformation and slight of hand you’re a goddamn fool!

OPEN THE F’KNG ECONOMY!!!"
KellyKe83344378,2020-04-21 16:10:01,"Los Angeles, CA",Twitter for Android,,They are hiring repose 3 for every house in car repossessing by the thousands evictions by the hundreds of thousands homeless by the Millions covid 19 has crossed all boundaries killed the stock market killed thousands of people kill the price of fuel killed our economy
dg5228,2020-04-21 16:10:01,"Washington, USA",Twitter for Android,,"It gets worse for the CDC. We knew the CDC sent out ""bad"" test kits. Now we know the kits were actually infected with COVID-19. And it wasn't a failure at a single lab.

At least 2 of the 3 labs that prepared and shipped these kits, sent infected ones.
https://t.co/oCwRpyg0Jb"
goancero,2020-04-21 16:10:00,"Mt. Laurel, NJ",Buffer,"businessadvice, strategy, TogetherAtHome","""Strengthen your communications and execute a strategic plan. These times will pass but they will take innovation, perseverance and collaboration."" #businessadvice #strategy #TogetherAtHome  @simonmainwaring @Forbes 
https://t.co/ZjGWi79D1J"
WDBJ7,2020-04-21 16:10:00,"Roanoke, Virginia",SocialNewsDesk,,"""At present I am suffering from intense muscle weakness and a temporary paralysis of my legs — I am unable to walk. However, physicians have assured me that I will recover,” Cross said in a social media post to fans. https://t.co/RViZSKRguj"
UIC_UPP,2020-04-21 16:10:00,"Chicago, IL",Twitter Web App,,THURSDAY Learn about ongoing racial &amp; spatial health disparities in Chicago and how it relates to COVID-19 and the U.S. Census. Register here: https://t.co/SawRhuZ0by https://t.co/FYcUtN4rCd
kwtx,2020-04-21 16:10:00,"Waco, Temple, Killeen, TX",Clickability by Upland,,Medical professionals call on states to release execution drug stockpiles needed to treat the most seriously ill COV https://t.co/nj66AUM8rw
