screen_name,created_at,location,source,hashtags,text
toweypat,2020-04-21 16:25:22,"Martinez, CA",Twitter Web App,,"Significant paper on the cost of misinformation. Basically, one standard deviation more viewership of Sean Hannity (denied seriousness of COVID) versus Tucker Carlson (took the pandemic seriously) is associated with in 20% more deaths at the county-level. https://t.co/7wDDXVOiu6 https://t.co/lvHijnhOA5"
yianna101,2020-04-21 16:25:22,USA,Twitter for Android,,"CNN's April Ryan Asks If Stay At Home Protestors Should Refuse Medical Care If They Contract COVID 

This is just sickening...

https://t.co/AlL59E0xMh"
mackdw1220,2020-04-21 16:25:21,"Arizona, USA",Twitter for iPhone,,"I saw alottaaa people say “Covid ain’t real”fuck Covid” “we good” and all that type shit like two months ago, a lot of those same people lost loved ones and have been personally infected."
itztamilkirukan,2020-04-21 16:25:21,"Washington, DC",Twitter for Android,,.@LLSusa has supported thousands of blood cancer patients and their families through the new LLS COVID-19 Patient Financial Aid Program. Please share or apply now: https://t.co/LRBL7zJkqj https://t.co/2OVXeSuhe4
Lnewman16Lee,2020-04-21 16:25:21,"Waukesha, WI",Twitter Web Client,,Texas official on reopening country: 'There are more important things than living' https://t.co/h0X3K38KyG
ajohn_campbell,2020-04-21 16:25:21,"San Francisco, CA",Twitter for iPhone,"fleet, webinar, employees","In case you missed it, watch our #fleet #webinar from last week. Learn best practices to keep your #employees safe, take advantage of #OilPrice, and find optimism in this downturn https://t.co/hoksXI2mvB"
VmkellerVanessa,2020-04-21 16:25:20,"Florida, USA",Twitter for iPhone,,Everyone seeking to understand the extent of Trump’s botched response to COVID-19 must recognize that Trump wasted one of the country’s best weapons to fight a pandemic: The Strategic National Stockpile of protective equipment. https://t.co/5ABsuqCZnr
ResedaRocks,2020-04-21 16:25:20,"Reseda, Los Angeles, California",Twitter for Android,,First at-home test kit authorized by ⁦@US_FDA⁩  https://t.co/7ccYaIwOOb
FilmmakersColl,2020-04-21 16:25:20,"Melrose, MA",Twitter Web App,"newyorker, photojournalist","Documenting the pandemic in Italy. Witnesses to heroism and heartache. #newyorker #photojournalist 
https://t.co/gxKWnK7yrw"
KCRoosSASSO,2020-04-21 16:25:20,"Kansas City, MO",Twitter Web App,"SAsupport, SAvoice, mentalhealth",Check out the @ASWISports weekly COVID-19 Black College Athletes Men's empowerment group on Friday at 12pm - details and how to register on the flyer!  #SAsupport #SAvoice #mentalhealth https://t.co/Nfp5yDfD5V
incomeisvital,2020-04-21 16:25:19,"Dallas, TX",Twitter for Android,,"Before CCP was killing people with Covid-19, they were killing people with fentanyl"
PghBizTimes,2020-04-21 16:25:18,"Pittsburgh, PA",True Anthem,,Gov. Tom Wolf on Tuesday said southwestern Pennsylvania's relatively low rate of COVID-19 infection will play a role in determining what parts of Pennsylvania will reopen beginning May 8. https://t.co/UWnrWdjHcH
crefan7860,2020-04-21 16:25:18,USA,Twitter Web App,,CBS reporter Weijia Jiang asked Trump why he downplayed COVID-19 — he told her to keep her voice down https://t.co/WF5Ylkphae
KeT1347,2020-04-21 16:25:18,"Alabama, USA",Twitter for iPhone,,Skylar Herbert has become the youngest victim in the state of Michigan to pass away from COVID-19 at 5 years old. Our prayers go out to her family at this time. 🕊 https://t.co/155FmdR9Z1
antipunctuation,2020-04-21 16:25:18,"Kent, OH",Twitter for Android,,can't wait for the Supreme Court to hold that COVID-19 is such an emergency that Trump can halt all immigration but not enough of an emergency to extend absentee voting in Wisconsin by 6 days
BellerinsDad,2020-04-21 16:25:18,👟 in FL; ❤️ in TN,Twitter for iPhone,,Can animals get COVID-19 or pass it to humans? Here’s everything pet owners need to know about the virus https://t.co/yqyjc2qP89
InLWithLBeingL,2020-04-21 16:25:18,"Maine, USA",Twitter for iPhone,,"This is criminal. @SpeakerPelosi is putting our health, our safety, and our tax dollars at risk with this irresponsible, cronyism appointment of Donna Shalala.

How is this any different from the appointments Trump makes.

#ShahidVsPelosi 

https://t.co/1UJ4KASMxx"
tomdabomb53,2020-04-21 16:25:17,"Massachusetts, USA",Twitter for iPhone,,"There is a way to safely reopen by summer, and stay open. It won’t be easy but it can be done. https://t.co/KCYF1ix82C"
Zadorozny20,2020-04-21 16:25:17,"Yorkville, IL",Twitter for Android,ICYMI,"#ICYMI on the air last week, @IBEW Local 134 Business Manager Don Finn's message of gratitude to Chicagoland’s union #electrical workers for their work to combat #COVID19 is continuing to air this week and beyond. https://t.co/OHrMBiEckK https://t.co/8uTAft6NpQ"
redeagletrader,2020-04-21 16:25:17,"Kansas City, MO",Twitter Web App,"EURUSD, 4HR48MA",Flat $EURUSD #EURUSD for +.244R trade (19.3p). Looks like the big covid swings are over. Time to start taking bigger profits off at 20p levels again. This downswing below the Apr 15 cross of the #4HR48MA at 1.0891 is over 6 days old at a mere 79p depth to 1.0891 followed my chop. https://t.co/jAkvzyT8e8
BetoIllinois,2020-04-21 16:25:16,"Illinois, USA",Twitter for iPhone,,Everyone seeking to understand the extent of Trump’s botched response to COVID-19 must recognize that Trump wasted one of the country’s best weapons to fight a pandemic: The Strategic National Stockpile of protective equipment. https://t.co/5ABsuqCZnr
AureliaCarion,2020-04-21 16:25:16,Maryland,Twitter for iPhone,,COVID-19 hearing some States are opening public businesses as early as Friday. https://t.co/UQZl2wdRh4
lizzirmweyant,2020-04-21 16:25:16,"Boston, MA",Twitter for Android,,"My mom, who immigrated to the US 50 years ago, is sewing masks for everyone in her apartment bldg. My brother-in-law immigrated to the US when he was a kid, and is treating COVID patients at the hospital where he works. How about we ban xenophobia, instead of banning immigration?"
johncantwell77,2020-04-21 16:25:15,"Yardley, PA",Twitter for iPhone,,Dunking on people who die of covid-19 after doubting widespread lockdown orders is becoming a media sport. And it's pretty ugly. https://t.co/BTEoE1BbPz
DanielsJarrell,2020-04-21 16:25:15,"Manhattan, NY",Twitter for iPhone,,"""Whenever there is disruption, depression, the communities that were already most harshly impacted are again most harshly impacted. It's really just a compounding of issues."" Responding to #COVID19 in NYC public housing, on the latest New Thinking. https://t.co/BHZIVAo05I"
cityofurbana,2020-04-21 16:25:15,"Urbana, Illinois",Twitter Web App,,SCAM ALERT/CONTACT TRACING-Be aware of a new text scam. CUPHD uses contact tracing for identifying people who have contact with someone who tested positive for COVID-19. They do this by calling people on the phone. You will never receive a text from CUPHD with this information. https://t.co/0zD6c9DRTQ
DrSteveEinstein,2020-04-21 16:25:15,"Buffalo, NY",Twitter for Android,,Hair cutting/styling and salon level nail care are THE panty-dropping skills of Covid-19.
bdr1976,2020-04-21 16:25:15,Southern CT,Twitter for iPhone,,"@muzpuf @KaitMarieox We are a danger to the world re Covid-19, skippy, not the other way around."
HHSRegion4,2020-04-21 16:25:15,"Atlanta, GA",Twitter Web App,COVID19,HHS’ @ACLgov is awarding nearly $1 billion in #COVID19 response funding to support older adults and people with disabilities living in the community + their family caregivers and to advocate for nursing home residents. $500M will go to meals for seniors. https://t.co/aFT0424Kk4 https://t.co/9TxFPQueFX
kcorb0427,2020-04-21 16:25:15,"Delaware, USA",Twitter for iPhone,,"Bombshell Confirmed, L.A. County already had 221k to 442k residents with COVID-19, making the fatality rate something like 0.1%...

4 days ago Santa Clara County reported the same.

No way California didn't know this, but they shut the state down anyway...
https://t.co/zIbnTn8v8w"
EmilyKivlehanMD,2020-04-21 16:25:15,"Chicago, IL",Twitter Web App,,"New: @CMSGov will require nursing homes to report COVID-19 cases directly to @CDCgov and make this information available to patients, families, staff and the public.  Thank you. Hopefully, this will help all levels of government target help urgently.

https://t.co/szNLRBW4ql"
RoknRob121,2020-04-21 16:25:15,"Corpus Christi, TX",Twitter Web App,"GetMePPE, OnSaleNow, Covid19, Masks, coronavirus","3-in-1 Face Sleeve. On Sale Now!
https://t.co/U9eyOztWOz

#GetMePPE #OnSaleNow #Covid19 #Masks #coronavirus #shopfromhome #StandTogether #Indigenous #SupportSmallBusiness #PPE #ShopLocal #COVID #protection #ShopMyCloset #CHH #Share #MasksNow #BeSafe #WearAMask #SaveALife https://t.co/wXzLfYZwUu"
mebobailey,2020-04-21 16:25:15,"Arkansas, USA",Twitter for iPhone,,@DY_Bill @heckyessica @CuomoPrimeTime @ChrisCuomo Where’s the proof he ever had Covid-19....other than his statements. Where’s your evidence?
edgardus3000,2020-04-21 16:25:15,"Charlotte County, Florida",Twitter for iPhone,,"Good news for me and my family.  Last week I tested positive for Covid antibodies, confirming I cleared the virus after weeks without symptoms.  I’ve also signed up for a clinical trial to donate my blood plasma and expect to make the donation in the coming weeks"
AM1280Brad,2020-04-21 16:25:14,"Minnesota, USA",Twitter for Android,,COVID-19 continues to spread throughout Minnesota with 17 deaths. https://t.co/rMSZNlvJsm
us888209,2020-04-21 16:25:14,Great state of Texas,Twitter for Android,,"WHO Warns Rush to Ease CCP Virus Restrictions May Lead to Resurgence
https://t.co/ifQhmK2u6v
 Like we should listen to an organization who so far has
✳️Helped China lie about 
     COVID       
✳️Spends more on lavish 1st-class airfare&amp; 5✨ hotels than AIDS,TB &amp;malaria combined🙄"
quietsolopursui,2020-04-21 16:25:14,"Grand Rapids, Michigan",Twitter Web App,NYC,"Okay, someone pointed me to this, which offers an actual figure for #NYC deaths from March 11 to April 13: 18,551. Which would imply 12,000 or more excess deaths. I cannot find the figure anywhere else, though, or the release.

https://t.co/1t7zW2dNy5"
JChangNYC,2020-04-21 16:25:14,"NYC, Seattle & Portland, OR",Twitter Web Client,,COVID-19: Not Your Typical ARDS? https://t.co/VFn3kHU4jn
nnyrual1,2020-04-21 16:25:14,"Brooklyn, NY",Twitter for iPhone,,"Say her name....Skylar Herbert, the daughter of Detroit first responders, is the first child with COVID-19 to die in Michigan. She was 5 years old. https://t.co/SvnTsqSKAV"
Autigger88,2020-04-21 16:25:14,"Woodstock, GA",Twitter for iPhone,"BuschWeddingGift, Sweepstakes",Our wedding was postponed d/t Covid-19. We have 5 nurses in our family including myself along with a lot of frontline guests. We plan to reschedule August 1st. Hopefully all we be well by then. 5-2-20 &gt; 8-1-20.  Free beer would be awesome!! TY #BuschWeddingGift #Sweepstakes https://t.co/BsohURcolc
SpiritServicesL,2020-04-21 16:25:14,"Idaho, USA",Twitter for Android,,"CNN's April Ryan Asks If Stay At Home Protestors Should Refuse Medical Care If They Contract COVID 

This is just sickening...

https://t.co/AlL59E0xMh"
iJaishSri,2020-04-21 16:25:14,"Texas, USA",Twitter for Android,,"Modi z... Said once "" चीन को लाल आंख दिखाने का वक़्त है""

This is golden opportunity to corner China by Uniting all big nations to boycott business ties &amp; imports of Goods in wake of Covid-19 anger.

India has enough skilled manpower to shift the Paradigm, Can Modi deliver it? https://t.co/3BR0e5o1ZL"
WayneJRivera2,2020-04-21 16:25:14,"Littleton, CO",Twitter for Android,,"CNN's April Ryan Asks If Stay At Home Protestors Should Refuse Medical Care If They Contract COVID 

This is just sickening...

https://t.co/AlL59E0xMh"
sxdoc,2020-04-21 16:25:14,USA,Twitter for iPhone,,"WHO Warns Rush to Ease CCP Virus Restrictions May Lead to Resurgence
https://t.co/ifQhmK2u6v
 Like we should listen to an organization who so far has
✳️Helped China lie about 
     COVID       
✳️Spends more on lavish 1st-class airfare&amp; 5✨ hotels than AIDS,TB &amp;malaria combined🙄"
Amanda_r_Banks,2020-04-21 16:25:13,Alabama,Twitter Web App,,"Talking about mortality with Covid-19 is like talking about the failure of Fannie Mae or AIG in 2008. Significant, but hardly the whole story."
fallwill,2020-04-21 16:25:13,"Detroit, MI",Twitter for Android,COVID19,"Today, we announced a partnership with @CVSHealth to provide drive-through rapid #COVID19 testing in the @cityofdearborn. We need COVID-19 testing now more than ever, and I’m grateful to @RepDebDingell for her leadership in ensuring we expand testing for the virus."
CLPHA,2020-04-21 16:25:13,"Washington, DC",Twitter Web App,COVID19,PHAs are supporting their most vulnerable residents during the #COVID19 pandemic in myriad ways. Check out this article from @urbaninstitute by @SJPopkin + CLPHA alum @MicaMOBrien and featuring CLPHA members @theHACCtweets &amp; @FortWayneHA   https://t.co/WOrQwBFAok
imxfctr,2020-04-21 16:25:13,"Leesburg, FL",Twitter for iPhone,,I really feel like Florida DEO is a joke and doesn’t care. It’s like they are trying to play defense and run out the clock on the COVID-19 pandemic just so they don’t have to pay the people who earned the right to get unemployment. I filed back in March and still no help...
smart_whit,2020-04-21 16:25:13,"California, USA",Twitter for iPhone,,COVID-19 'Survivor' Chris Cuomo And CNN Pretend He Just Left His Basement. But He Was Berating A Bicyclist On Easter Sunday. https://t.co/hFcg6diu5d via @gatewaypundit
DuskComics,2020-04-21 16:25:13,"Texas, USA",Twitter Web App,,"On National Library Workers Day, ALA Executive Board reaffirms need to protect safety and well-being of library workers during COVID-19 pandemic

https://t.co/V29CWF6ohZ"
RobertC00177864,2020-04-21 16:25:13,"North Carolina, USA",Twitter for iPhone,,"Gov. DeSantis: Florida 'has flattened the curve' without 'draconian orders'

https://t.co/wjyjewpyS4"
Qin2it,2020-04-21 16:25:12,"Colorado, USA",Twitter for Android,,"Joe Biden: Dr. Anthony Fauci should be 'only person' public hears from during COVID-19 crisis 🤔

Why not Dr. Birx?

This sounds sexist to me.  Maybe Dr. Birx is just too old for his liking 😏

https://t.co/WWFr2qApGz"
AutonomousUnion,2020-04-21 16:25:12,"Albany Park Chicago, IL",Twitter for iPhone,,"COVID-19 OUTBREAKS IN HOMELESS SHELTERS THREATEN TO OUTPACE CITY RESPONSE

https://t.co/5f4qeRhFI8

Tell @chicagosmayor to lease up the 2,000 vacant CHA units to homeless residents in need IMMEDIATELY &amp; #HouseUsAll!

➡️  https://t.co/PNkHjRdulq 📨
➡️  https://t.co/dFzQ7G3yZN 📞"
eangels1064,2020-04-21 16:25:12,"California, USA",Twitter for iPhone,,"President Trump now seeks to distract us from his fumbled COVID-19 response by trying to put the blame on immigrants. The truth is many immigrants are on our front lines, protecting us as doctors, nurses, health aids, farmworkers, and restaurant workers. https://t.co/nJef4W5qZK"
lastonepicked,2020-04-21 16:25:12,"Contra Costa County, CA",Twitter Web App,,"""An Ohio man who dismissed the coronavirus pandemic as a 'political ploy' and ripped his state’s lockdown as 'bullshit,' has died of COVID-19, according to reports. https://t.co/LepwEDkbGk"
bull_pamela,2020-04-21 16:25:12,"Michigan, USA",Twitter for iPhone,,"A sad &amp; pathetic comparison, which only highlights the hideousness of Democrat leadership... https://t.co/fA6XLYwkqx"
NewsTalkWEJS,2020-04-21 16:25:12,"Williamsport, PA",Twitter Web App,,UPDATE: Lycoming County has a pair of COVID-19 cases in Nursing Home or PCH https://t.co/YeJHRudFVz
FIREYOSE,2020-04-21 16:25:11,"Dallas, TX",Twitter for Android,Project100,"I’m thrilled to be a part of @GiveDirectly’s #Project100. Our goal is to give $1000 cash to 100K families. The pilot program has already sent money to nearly 5,000 families, but it’s not enough. Let’s make this happen for more families: https://t.co/G8O8893ltH 👍 https://t.co/hDe4TOJnCo"
jp1730,2020-04-21 16:25:11,"Millen, GA",Twitter for iPhone,,"510 deaths attributed to Covid-19 (some surely miscoded) in the US of persons 45 years and younger. There are 190,000,000 persons in the US 45 years and younger. It’s time to get back to work. All systems go on May 1 in my opinion."
Jeremy_Horn,2020-04-21 16:25:11,"Chicago, IL",Twitter Web App,,"@Griffgyrl @UnsungProducers @tvonetv @Toure Also, I hope that CEO of SOLAR UK named Jessie Tsang can participate as well. Please check on her. I'm so worried about what she's going through with the COVID-19 pandemic and the racism. Thanks Carolyn!"
quietsolopursui,2020-04-21 16:25:11,"Grand Rapids, Michigan",Twitter Web App,COVID,"To be clear: New York City has obviously suffered excess deaths from #COVID in the last month (as has Spain, as has Italy). But that does not mean the numbers being widely reported are accurate, or represent the actual change that would have occurred if #SARSCoV2 did not exist..."
Mikeaveli2682,2020-04-21 16:25:11,"Los Angeles, California",Twitter for iPhone,,"First, Epstein confidently claimed COVID-19 would take only 500 American lives when it was all said &amp; done. Then, he conceded he made a basic math error and revised his estimate to 5,000. We're now past 40,000 and counting, but today, he doubles-down. https://t.co/idtKi2nWiT"
gcoker1000,2020-04-21 16:25:11,Michigan,Twitter Web App,,Themes of Passover resonate during COVID-19 shutdown https://t.co/RNKRo5qjax
IdahoMRAN,2020-04-21 16:25:11,"Boise, ID",Hootsuite Inc.,,Nutrition should be a priority during this time to ensure your immune system is healthy and responsive. Learn more: https://t.co/LYcjIc0LK8
49nersutefan,2020-04-21 16:25:10,"Dumbfuckistan, Utah, USA",Twitter for Android,StayHome,"#StayHome

“If you jump the gun and go into a situation where you have a big spike, you’re going to set yourself back,” Fauci cautioned. https://t.co/cXobe60OyR via @HuffPostPol"
Mmarty1230,2020-04-21 16:25:10,"California, USA",Twitter Web App,,"CNN's April Ryan Asks If Stay At Home Protestors Should Refuse Medical Care If They Contract COVID 

This is just sickening...

https://t.co/AlL59E0xMh"
MCarter584,2020-04-21 16:25:10,"Dickson, TN",Twitter for iPhone,,"Good news for me and my family.  Last week I tested positive for Covid antibodies, confirming I cleared the virus after weeks without symptoms.  I’ve also signed up for a clinical trial to donate my blood plasma and expect to make the donation in the coming weeks"
NYCFC_914,2020-04-21 16:25:10,"Yonkers, NY",IFTTT,"NYCFC, MLSUnites","RT NYCFC ""#NYCFC and CaptainMorganUS Team Up to Help South Bronx COVID-19 Relief Effort as Part of #MLSUnites 

DETAILS ➡️ https://t.co/h9d5NIxwEq https://t.co/ZFn2GV87en"""
dragohylndr,2020-04-21 16:25:10,"Wichita, KS",Twitter for Android,FakeNewsMedia,"This GIF is an excellent representation of @TheDemocrats and #FakeNewsMedia overall.

What they fail to register is that they’re dancing with themselves (again); that their COVID-19 weaponization hasn’t changed a single mind or vote.

@realDonaldTrump has done a phenomenal job. https://t.co/7hnFtl544w"
DavidPDuffy25,2020-04-21 16:25:10,"Borough of Queens, NYC, NY USA",Twitter for iPad,,@PALE_Primate @Cernovich @ScottAdamsSays @HarmlessYardDog @MisterAntiBully Data from @Graphika_NYC shows right-leaning Americans were early to turn attention to Covid. https://t.co/ae80Rv7zxF
ddm16hs,2020-04-21 16:25:10,"Austin, TX",Twitter for iPhone,,Tim Robinson mocking COVID protestors. The man is a saint. https://t.co/uiuW64UM9E
kutney32,2020-04-21 16:25:10,"Out on the farm, USA",Twitter Web App,,"IMO, NO!  On the death certificate COVID-19
should only be used as cause of death if not other diagnosis supersedes it. @realDonaldTrump I’m sure the Pathologists
know this. Fauci’s figures are very questionable! https://t.co/3l1W6ZhQs4"
MACVorg,2020-04-21 16:25:10,Minnesota,Hootsuite Inc.,,"Share with Vets

COVID-19 Disaster Relief Grant is to mitigate the negative effects and economic impact COVID-19 has had on Veterans and their families by providing a one-time financial relief grant in the amount of $1,000.

COVID-19 Financial Assistance 

https://t.co/9B6h7s7LT8"
ASCETweets,2020-04-21 16:25:09,"Reston, VA",Hootsuite Inc.,"infrastructure, COVID19","“The pandemic presents opportunities to restructure how we design, govern &amp; educate for a future that will probably see even more shocks on our systems.”

Professors and researchers at @ASU examine what our #infrastructure's response to #COVID19 reveals: https://t.co/rTHoJm0Z4i. https://t.co/R7Q7i7Lyy0"
WLKY,2020-04-21 16:25:09,"Louisville, KY",SocialNewsDesk,,First responders worried they'll bring home COVID-19 can stay at Galt House https://t.co/QF9orrKgxF
dakotapred,2020-04-21 16:25:09,"Nashville, TN",Twitter for iPhone,,Rep. Cohen: Quick reopening of Tennessee businesses is a mistake that will lead to deaths https://t.co/4vDV3dtpDh
D28Dems,2020-04-21 16:25:09,"Phoenix & Paradise Valley, AZ",Twitter Web App,VoteMarsh,"""Farnsworth said 'Satan is behind' the restrictions on commerce and movement.""

This is why we need new majority. One moderate cannot stop this madness. #VoteMarsh

https://t.co/uD1MnpB2ic"
filafresh,2020-04-21 16:25:09,"Screwston, Texas",Twitter for Android,,COVID-19 hearing some States are opening public businesses as early as Friday. https://t.co/UQZl2wdRh4
ehthayer,2020-04-21 16:25:09,Likely Massachusetts,Twitter for iPhone,,Interesting https://t.co/Ygz5BBVYlx
onemoreresister,2020-04-21 16:25:09, WA,Twitter for Android,,"All the experts say we need to greatly expand COVID-19 testing capacity to safely re-open America. 

The White House promised 27 million tests by the end of March.

As of last week, only 4 million have been conducted.

Where are the tests?

https://t.co/24e9z3G2iU"
TheGivingBlock,2020-04-21 16:25:09,"Washington, DC",Twitter Web App,cryptoCOVID19,@CharlieShrem @BlockWorksGroup Welcome to #cryptoCOVID19 - Help us fight COVID-19 by supporting nonprofits on the front lines. Hope to see you on the felt.
FairVoteGA,2020-04-21 16:25:08,Georgia,Twitter for iPhone,,New from @AP Global Investigative team: 75 publicly listed companies received $300M in SBA loans due to COVID-19. 25% had warned even before the virus hit that they were in potentially failing financial health. Others were recently under SEC investigation: https://t.co/RWDQWAr4ea
EricZee3,2020-04-21 16:25:08,"Michigan, USA",Twitter for Android,,"I saw alottaaa people say “Covid ain’t real”fuck Covid” “we good” and all that type shit like two months ago, a lot of those same people lost loved ones and have been personally infected."
Doug_R_Kuhn,2020-04-21 16:25:08,"Los Angeles, CA",Twitter Web App,,"@dvora_x @mansbrahm Might be a wise idea to wait a bit, especially with this COVID thing creating havoc everywhere."
Malachi_93,2020-04-21 16:25:08,"West Fargo, ND",Twitter Web App,,"Just in: ND Department of Health confirms +18 COVID-19 cases in the state from 240 new test results
17 people hospitalized of 54 ever
13 deaths total (none new reported)
214 people recovered 
417 active cases of 644 total 
14,987 tests done in ND"
marciasgreen,2020-04-21 16:25:08,"New Mexico, USA",Twitter Web App,essentialbusiness,Need help defining an #essentialbusiness in Mass? https://t.co/tkbc9itOdn
DebbieNester1,2020-04-21 16:25:07,USA,Twitter for Android,,"NEW: 481 people died of COVID-19 in New York state in the last 24 hours, Gov. Cuomo says. https://t.co/jFoJwya9aP https://t.co/bYuMif8nOh"
BernFoster1,2020-04-21 16:25:07,"Evanston, IL",Twitter for iPhone,COVID19,"Today, we announced a partnership with @CVSHealth to provide drive-through rapid #COVID19 testing in the @cityofdearborn. We need COVID-19 testing now more than ever, and I’m grateful to @RepDebDingell for her leadership in ensuring we expand testing for the virus."
Resilience_NU,2020-04-21 16:25:07,"Boston, MA",Hootsuite Inc.,"Resilience101, ResilienceChampion, COVID19, StaySafeStayResilient","#Resilience101: Today we're highlighting GRI’s #ResilienceChampion Kristen Lee because of her guidance in protecting your mental health &amp; well-being during #COVID19. We’ve put together Dr. Lee’s insights as a resource to help you #StaySafeStayResilient. 
https://t.co/OPJtHGxrft https://t.co/CGlZhVP9W2"
JohnsHopkinsMMI,2020-04-21 16:25:07,"Baltimore, MD",Twitter for iPad,COVID19,"#COVID19 outcomes are worse for men than women across the world.

What sex and gender differences could be at play behind that trend?

@SDesmon talked to @SabraKlein1998 and @RosemaryJMorgan to find out.

🔗 https://t.co/VJmQh0ahL8
#️⃣ #coronavirus
&lt;br/&gt;https://t.co/pI4VQ3BY8r"
Jomasimp,2020-04-21 16:25:07,"Los Angeles, CA",Twitter for iPad,,So. The first governor to start re-opening his state is the one who said last month that he didn't know COVID could be passed by asymptomatic persons? Do I have that right?
court_franklin,2020-04-21 16:25:07,"Colorado Springs, CO",Twitter for iPhone,,I’m sitting here getting hate messages from a 50+ year old man that wants to say it’s unfair that he isn’t getting a raise during COVID-19.
namhenderson,2020-04-21 16:25:07,"Mile High, CO",Twitter Web App,,"Dr. Samsun Lampotang, a UF professor of anesthesiology, is leading a worldwide network of coders, engineers, physicians and ham radio operators in designing a pandemic ventilator that can be built from hardware store parts for less than $250. https://t.co/QYBCozcoXN"
